{
  "schemaVersion": 1,
  "registrationId": "simulation-rigid-body-2d-v1-controlled",
  "frozenCatalogId": "simulation.rigid-body-2d.v1",
  "frozenCatalogSha256": "6665664f984683e5b7d3fdc8c1602198124844704c224a526d48be2f02edf9d4",
  "sourceCommit": "5673067cb6ceb725080f599525ef0f391684c7e2",
  "fixture": {
    "path": "public/artifacts/simulation-rigid-body-2d-v1/fixture.bin",
    "bytes": 22704,
    "sha256": "8ea94bb93e6eafaaa9824750da76da143e8676a8bb8db22074f3abe354a90e42",
    "generator": "generateRigidBodyFixture; xorshift32 seed 0x5242474e",
    "licenseSpdx": "CC0-1.0",
    "redistribution": "permitted",
    "containsExternalData": false
  }
}
